{
  "version": "cA-1.0-pro",
  "contract_version": "blux-ca-report-1.1",
  "fixture_id": "policy_pack_matrix",
  "engine": {
    "name": "blux-ca",
    "line": "cA-1.0-pro",
    "dataset_version": "cA-1.0-pro"
  },
  "request": {
    "policy_pack_id": "cA-mini",
    "policy_pack_version": "1.0",
    "profile_id": "default",
    "profile_version": null,
    "device": null
  },
  "mode": "acceptance",
  "status": "fail",
  "outcome": "fail",
  "checks": [
    {
      "id": "policy_pack.decision",
      "status": "pass",
      "notes": "Decision recorded for cA-mini."
    },
    {
      "id": "policy_pack.blocking",
      "status": "pass",
      "notes": "Request blocked as expected under cA-mini."
    }
  ],
  "policy_pack": "cA-mini",
  "tier": "mini"
}
