{
  "version": "cA-1.0-pro",
  "contract_version": "blux-ca-report-1.1",
  "fixture_id": "validator_pack",
  "engine": {
    "name": "blux-ca",
    "line": "cA-1.0-pro",
    "dataset_version": "cA-1.0-pro"
  },
  "request": {
    "policy_pack_id": "cA-pro",
    "policy_pack_version": "1.0",
    "profile_id": "default",
    "profile_version": null,
    "device": null
  },
  "mode": "acceptance",
  "status": "pass",
  "outcome": "pass",
  "checks": [
    {
      "id": "validator.schema",
      "status": "pass",
      "notes": "Schema validator pack passed."
    },
    {
      "id": "validator.determinism",
      "status": "pass",
      "notes": "Determinism check passed."
    }
  ],
  "validator_pack": "core"
}
