{
  "version": "cA-1.0-pro",
  "contract_version": "blux-ca-report-1.1",
  "fixture_id": "legacy_outputs",
  "engine": {
    "name": "blux-ca",
    "line": "cA-1.0-pro",
    "dataset_version": "cA-1.0-pro"
  },
  "request": {
    "policy_pack_id": "cA-pro",
    "policy_pack_version": "1.0",
    "profile_id": "default",
    "profile_version": null,
    "device": null
  },
  "mode": "acceptance",
  "status": "pass",
  "outcome": "pass",
  "checks": [
    {
      "id": "compat.current",
      "status": "pass",
      "notes": "Current output captured for compatibility baseline."
    }
  ]
}
